"DSZH","JYDSZH","DSKHYH"
成都江雪医疗器械有限公司,"30022002215558400016",成都银行
潍坊益聚电子科技有限公司,"1607001709200114174",工行山东潍坊分行
武冈凌峰新能源材料有限公司,"800252526401012",长沙银行股份有限公司
青岛元康国际物流有限公司,"802360200441058",青岛银行
上海宝爵汽车服务有限公司,"121930843410201",招商银行股份有限公司
潍坊仁和物流有限公司,"10662000000302013",华夏银行股份有限公司总行
泰安科华工贸有限责任公司,"106364946301018",泰安银行股份有限公司开发区支行
重庆财森机械设备制造有限公司,"3100082409024876666",沙坪坝青木关支行
深圳市众创分享科技有限公司,"79250078801300000090",上海浦东发展银行
中国平安财产保险股份有限公司,"11014282404102",平安银行（原深圳发展银行）
洛阳伟伦广告有限公司,"13210078801900000452",上海浦东发展银行
沈阳三段锦文化传播有限公司,"71090078801500000017",上海浦东发展银行
广州市仁创通讯科技有限公司,"3602062729200223744",工行科技园支行
中国人寿财产保险股份有限公司,"91010078801300000302",上海浦东发展银行
东莞市源岭硅胶科技有限公司,"510000501003155",东莞银行股份有限公司
宿州市赵小培商贸有限公司,"56930188000031262",中国光大银行
济南万茂商贸有限公司,"1176914000000001216",齐鲁银行济南大桥路支行
徐州天利达建筑安装工程有限公司,"88322100143060000018",昆仑银行
襄阳青历商贸有限公司,"1804002109200031423",襄阳朝阳路支行
靖西市永忠商贸有限责任公司,"2110604509201076529",百色靖西支行营业室
济南炫捷信息技术有限公司,"811010201421000980",泰安银行股份有限公司济南分行
烟台翰润建材有限公司,"1606021209200061561",工行烟台莱阳支行
夏津县福大家商贸有限公司,"91404030020100011902",山东省农村信用社联合社
东莞市双运五金制品有限公司,"2010016409100049925",厚街支行
北京新快网络科技有限公司,"110926947810505",招商银行
兰州叁纪电讯科技有限公司,"931904089310902",招商银行
深圳市威宇智通科技有限公司,"4000093419100173877",深圳高新园北区支行
捷信消费金融有限公司,"122903873910991",招商银行
汝州市博讯泽文化有限公司,"410403010110016802",中原银行股份有限公司
青岛丰顺祥工贸有限公司,"802690200166205",青岛银行
宿州市博欧驰商贸有限公司,"56930188000033982",中国光大银行
青岛贵才轩网络科技有限公司,"38270188000035813",中国光大银行
北京学志大鹏信息咨询有限公司,"91010078801100000100",上海浦东发展银行
深圳塞翁科技有限公司,"4000029309200383159",工行深圳市分行海王支行
青岛宝林达国际货运代理有限公司,"802060200577315",青岛银行
洛阳占英金属材料有限公司,"13210078801500000446",上海浦东发展银行
山东典汇石化有限公司,"810101701421014849",日照银行股份有限公司海滨二路支行
中国人民财产保险股份有限公司山东省分公司,"1602003019288888866",工行山东省济南市历下支行
青岛尚迅杰汽车维修有限公司,"77110188000164301",中国光大银行
山东菏泽万云达电梯有限公司,"1609030009200113243",工行菏泽开发支行
福建号码网软件开发有限公司,"592904521810401",招商银行股份有限公司
中国太平洋财产保险股份有限公司,"31595603002974753",上海银行股份有限公司
青岛蓝帆新材料有限公司,"802620200335458",青岛银行
重庆致煌汽车零部件有限公司,"3100081019200048629",工行重庆双桥支行
财付通支付科技有限公司客户备付金,"4550200001819100094021",福田支行
支付宝(中国)网络技术有限公司客户备付金,"66090183910000245",之江支行
广州市慧友迪贸易有限公司,"44078001040017613",中国农业银行股份有限公司广州番禺支行
惠州市泰华房地产开发有限公司,"9550880207628300223",广东发展银行股份有限公司运营作业部
广州斯琪圣贸易有限公司,"44050140011500000829",中国建设银行股份有限公司广州东宝大厦支行
财付通支付科技有限公司,"69040181910009407",华夏银行深圳分行福田支行
